{
  "project_id": "example-project",
  "project_profile_revision": "example-project-profile-v2",
  "record_version": "1.0",
  "learning_id": "LR-DEMO",
  "run_id": "EX-RUN-001",
  "task_id": "EX-1-T001",
  "learning_type": "hypothesis",
  "statement": "A narrower audience statement may improve comprehension.",
  "evidence": [
    {
      "artifact_ref": "evidence/packets/demo.json",
      "artifact_revision": "r1",
      "artifact_sha256": "b000000000000000000000000000000000000000000000000000000000000002"
    }
  ],
  "causal_claim": false,
  "experiment_ref": null,
  "confidence": "low",
  "recommended_change": "Test the narrower statement before adopting it.",
  "supersedes": null,
  "created_at": "2026-08-31T19:02:00Z"
}
